[
  {
    "id": "promo_facial_balancing",
    "serviceId": "svc_facial_balancing",
    "headlineKey": "",
    "descriptionKey": "",
    "validFrom": null,
    "validTill": "2026-03-14",
    "options": []
  },
  {
    "id": "promo_lip_fillers",
    "serviceId": "svc_lip_fillers",
    "headlineKey": "promo.lip_fillers.headline",
    "descriptionKey": "",
    "validFrom": null,
    "validTill": "2026-03-14",
    "options": []
  },
  {
    "id": "promo_hyaluronidase",
    "serviceId": "svc_hyaluronidase",
    "headlineKey": "",
    "descriptionKey": "",
    "validFrom": null,
    "validTill": null,
    "options": []
  }
]
